{"schemaVersion":1,"snapshotId":"2026-10-26","groups":[{"id":"fruit_veg","label":"Fruit and vegetables"},{"id":"cereals","label":"Cereals"},{"id":"meat","label":"Meat"},{"id":"dairy","label":"Dairy"},{"id":"sugar_beverages","label":"Sugar, coffee and cocoa"}],"commodities":[{"id":"tomatoes","datasetId":"trade.tomatoes","group":"fruit_veg","label":"Tomatoes","definition":"Tomatoes, fresh or chilled (HS 0702). Excludes processed tomatoes.","hsScope":"HS 0702","path":"snapshots/2026-10-26/trade/tomatoes.json","months":{"first":"2019-01","last":"2026-08","provisionalFrom":"2025-03"}},{"id":"potatoes","datasetId":"trade.potatoes","group":"fruit_veg","label":"Potatoes","definition":"Potatoes, fresh or chilled, including seed potatoes (HS 0701). Excludes frozen and processed potatoes.","hsScope":"HS 0701","path":"snapshots/2026-10-26/trade/potatoes.json","months":{"first":"2019-01","last":"2026-08","provisionalFrom":"2025-03"}},{"id":"strawberries","datasetId":"trade.strawberries","group":"fruit_veg","label":"Strawberries","definition":"Fresh strawberries (HS 0810 10). Excludes frozen strawberries.","hsScope":"HS 0810 10","path":"snapshots/2026-10-26/trade/strawberries.json","months":{"first":"2019-01","last":"2026-08","provisionalFrom":"2025-03"}},{"id":"apples","datasetId":"trade.apples","group":"fruit_veg","label":"Apples","definition":"Apples, fresh (HS 0808 10), including cider apples in bulk. Excludes dried, frozen and processed apples.","hsScope":"HS 0808 10","path":"snapshots/2026-10-26/trade/apples.json","months":{"first":"2019-01","last":"2026-08","provisionalFrom":"2025-03"}},{"id":"oranges","datasetId":"trade.oranges","group":"fruit_veg","label":"Oranges","definition":"Oranges, fresh or dried (HS 0805 10). Excludes mandarins and other citrus, and orange juice.","hsScope":"HS 0805 10","path":"snapshots/2026-10-26/trade/oranges.json","months":{"first":"2019-01","last":"2026-08","provisionalFrom":"2025-03"}},{"id":"bananas","datasetId":"trade.bananas","group":"fruit_veg","label":"Bananas","definition":"Bananas including plantains, fresh or dried (HS 0803).","hsScope":"HS 0803","path":"snapshots/2026-10-26/trade/bananas.json","months":{"first":"2019-01","last":"2026-08","provisionalFrom":"2025-03"}},{"id":"wheat","datasetId":"trade.wheat","group":"cereals","label":"Wheat","definition":"Wheat and meslin, including durum wheat and seed for sowing (HS 1001). Excludes flour.","hsScope":"HS 1001","path":"snapshots/2026-10-26/trade/wheat.json","months":{"first":"2019-01","last":"2026-08","provisionalFrom":"2025-03"}},{"id":"rice","datasetId":"trade.rice","group":"cereals","label":"Rice","definition":"Rice at every stage (HS 1006): in the husk, husked (brown), semi-milled or wholly milled, and broken. Excludes rice flour.","hsScope":"HS 1006","path":"snapshots/2026-10-26/trade/rice.json","months":{"first":"2019-01","last":"2026-08","provisionalFrom":"2025-03"}},{"id":"beef","datasetId":"trade.beef","group":"meat","label":"Beef and veal","definition":"Meat of bovine animals, fresh, chilled or frozen (HS 0201, 0202). Excludes offal, and processed or preserved beef.","hsScope":"HS 0201, 0202","path":"snapshots/2026-10-26/trade/beef.json","months":{"first":"2019-01","last":"2026-08","provisionalFrom":"2025-03"}},{"id":"sheep-goat","datasetId":"trade.sheep-goat","group":"meat","label":"Sheep and goat meat","definition":"Meat of sheep or goats, fresh, chilled or frozen (HS 0204). The trade codes do not separate lamb from mutton or goat meat. Excludes offal and processed meat.","hsScope":"HS 0204","path":"snapshots/2026-10-26/trade/sheep-goat.json","months":{"first":"2019-01","last":"2026-08","provisionalFrom":"2025-03"}},{"id":"poultry","datasetId":"trade.poultry","group":"meat","label":"Poultry meat","definition":"Meat and edible offal of poultry (fowls, turkeys, ducks, geese, guinea fowls), fresh, chilled or frozen (HS 0207). Excludes processed and preserved poultry.","hsScope":"HS 0207","path":"snapshots/2026-10-26/trade/poultry.json","months":{"first":"2019-01","last":"2026-08","provisionalFrom":"2025-03"}},{"id":"milk-products","datasetId":"trade.milk-products","group":"dairy","label":"Milk products (not cheese)","definition":"Milk and cream, concentrated and powdered milk, yoghurt, buttermilk, whey and butter (HS 0401–0405). Excludes cheese, which is a separate basket. Net mass adds products as recorded (liquid milk, powders, butter), not converted to a milk equivalent.","hsScope":"HS 0401–0405","path":"snapshots/2026-10-26/trade/milk-products.json","months":{"first":"2019-01","last":"2026-08","provisionalFrom":"2025-03"}},{"id":"cheese","datasetId":"trade.cheese","group":"dairy","label":"Cheese","definition":"Cheese and curd (HS 0406).","hsScope":"HS 0406","path":"snapshots/2026-10-26/trade/cheese.json","months":{"first":"2019-01","last":"2026-08","provisionalFrom":"2025-03"}},{"id":"sugar","datasetId":"trade.sugar","group":"sugar_beverages","label":"Sugar","definition":"Cane or beet sugar and chemically pure sucrose, in solid form, raw or refined (HS 1701). Excludes molasses and sugar confectionery.","hsScope":"HS 1701","path":"snapshots/2026-10-26/trade/sugar.json","months":{"first":"2019-01","last":"2026-08","provisionalFrom":"2025-03"}},{"id":"coffee","datasetId":"trade.coffee","group":"sugar_beverages","label":"Coffee","definition":"Coffee, roasted or not, decaffeinated or not; coffee husks and skins; substitutes containing coffee (HS 0901). Excludes instant coffee, extracts and essences (HS 2101).","hsScope":"HS 0901","path":"snapshots/2026-10-26/trade/coffee.json","months":{"first":"2019-01","last":"2026-08","provisionalFrom":"2025-03"}},{"id":"cocoa","datasetId":"trade.cocoa","group":"sugar_beverages","label":"Cocoa","definition":"Cocoa beans, cocoa paste, cocoa butter and cocoa powder (HS 1801, 1803–1805). Excludes cocoa shells (1802) and chocolate (1806). Net mass adds beans and products as recorded, not converted to a bean equivalent.","hsScope":"HS 1801, 1803–1805","path":"snapshots/2026-10-26/trade/cocoa.json","months":{"first":"2019-01","last":"2026-08","provisionalFrom":"2025-03"}}]}
